{
  "schema_version": "1.0",
  "workflow_id": "replace-with-workflow-id",
  "risk": "D",
  "project_adapter": null,
  "design_pack": [],
  "lanes": [],
  "screenshots": [],
  "coverage": null,
  "human_decision": {
    "decision": null,
    "artifact": null,
    "signer": null,
    "signer_role": null,
    "decided_at": null,
    "decision_source": null,
    "notes": null,
    "notes_closure": null
  },
  "freeze": {
    "document": null,
    "payload": null,
    "screenshots": []
  },
  "parity_plan": null,
  "parity_report": null,
  "runtime_evidence": [],
  "review_urls": []
}
